{
  "contract_type": "run_trace",
  "contract_version": "3.5.0",
  "run_id": "run_543ad9470d1318e6042f7e1b83e1ce28",
  "run_identity": {
    "benchmark_id": "financial-agent-reliability-v3.5",
    "case_id": "case-public-fkw-07-single-factor-perturbation-v3",
    "harness_config_sha256": "845f0f935882b8359ff5a0ab8c4181dd9090c484272937588ec6894ba15716e4",
    "immutable_bundle_sha256": "d6b100223a3874beb165e184b13fe9b2866e22c019772dd711b0ad2303453a54",
    "repeat": 1,
    "requested_model_id": "glm-5.2",
    "seed": 1589982729,
    "variant_id": "single_factor_stress"
  },
  "status": "failed",
  "provider": {
    "name": "bailian",
    "requested_model_id": "glm-5.2",
    "response_model_id": "glm-5.2",
    "endpoint_id": "bailian_98bd231ca931",
    "model_manifest_sha256": "8b727749db3e29a081a4f48aae7bdf98149ac2f602bf10bda1220a330d5cd763"
  },
  "request": {
    "parameters": {
      "temperature": 0,
      "top_p": 1,
      "max_tokens": 4096,
      "seed": 1589982729,
      "stream": true,
      "tool_stream": false,
      "parallel_tool_calls": false,
      "enable_thinking": null
    },
    "tool_choice": "auto",
    "payload_sha256s": [
      "cc0e82e4b53f70716ae76c2a61e978d68c5762d56f4a44887a1673a55904889b",
      "9a11977593fd6854ed314c58c499d684302e41ea4cd3403e897913c9583f54b4",
      "8bebefbcd84da30cace396a4e06952d708d6e7fa375ec66606e653c3a57fdfe1"
    ],
    "sdk_retries": 0
  },
  "preflight": {
    "performed": true,
    "identity_match": true,
    "fallback_detected": false,
    "fallback_attempted": false,
    "parameters_honored": false,
    "valid": false,
    "authoritative_preflight_sha256": "e45685c9e1f1c255706ccabb5efa1a10058876d00035ff5f161c530c8b46aad4"
  },
  "context": {
    "system_prompt_sha256": "efa79e6c40e81fee12d0fd6f9c1465e6191bfeb5c65a075493b94a44439155d8",
    "tool_schema_sha256": "977d073e9011226d01c78b72a9f5caeef83659d73409cf2cb134fb2338ea1919",
    "candidate_projection_sha256": "f94006c7b659401712deb8d3896eac4e97ea5d517dda2d6ec23ec89156dddf72",
    "frozen_snapshot_sha256": "1abfafcd1b13b4e64d2161a77f8dffae855d48c0edc8a5f8836905f87c9ec563",
    "messages_count": 6
  },
  "tool_calls": [
    {
      "event": "start",
      "tool_call_id": "call_e91bbf1b9c684c3c8c4bd2c4",
      "tool_name": "read_frozen_case",
      "arguments": {
        "case_id_sha256": "f5dcf99a3c3bc95ec783330c89c5e430fb6cc0d32484ac4e9f54d31444fb3362"
      },
      "started_at": "2026-08-12T04:27:30.406Z"
    },
    {
      "event": "end",
      "tool_call_id": "call_e91bbf1b9c684c3c8c4bd2c4",
      "tool_name": "read_frozen_case",
      "arguments": {
        "case_id_sha256": "f5dcf99a3c3bc95ec783330c89c5e430fb6cc0d32484ac4e9f54d31444fb3362"
      },
      "is_error": false,
      "result_sha256": "8e3f619cedf97b0868802e3824351642cf2d99cc6db153c0c3d258fe6cd8ed31",
      "finished_at": "2026-08-12T04:27:30.406Z"
    },
    {
      "event": "start",
      "tool_call_id": "call_a8e2831da68440548ed49a54",
      "tool_name": "read_frozen_evidence",
      "arguments": {
        "snapshot_id_sha256": "a79f7e46ea0d2e3241db5a4532aa79a1126a9d7c3415b1878765c703b61d3402",
        "record_id_sha256": "5e6ccc1f0bb93f641139e44cb9e8aa95841241c401eca1900f1b253a7460a5e8"
      },
      "started_at": "2026-08-12T04:27:33.769Z"
    },
    {
      "event": "end",
      "tool_call_id": "call_a8e2831da68440548ed49a54",
      "tool_name": "read_frozen_evidence",
      "arguments": {
        "snapshot_id_sha256": "a79f7e46ea0d2e3241db5a4532aa79a1126a9d7c3415b1878765c703b61d3402",
        "record_id_sha256": "5e6ccc1f0bb93f641139e44cb9e8aa95841241c401eca1900f1b253a7460a5e8"
      },
      "is_error": false,
      "result_sha256": "903c5523c57a58d53930bab9be7266b5a14a545ae3ab29694146f9f80ff270d2",
      "finished_at": "2026-08-12T04:27:33.769Z"
    }
  ],
  "evidence_observations": {
    "FKW-07-CAN-2021": {
      "available_at": "2026-08-11T00:24:14.255023Z"
    }
  },
  "environment": {
    "dataset_access": "frozen_read_only",
    "ledger_mode": "simulated",
    "initial_ledger": {},
    "final_ledger": {},
    "final_state_matches_initial": true,
    "real_side_effects": false,
    "network_scope": "bailian_inference_only"
  },
  "timing": {
    "started_at": "2026-08-12T04:27:28.205Z",
    "finished_at": "2026-08-12T04:27:34.300Z",
    "duration_ms": 6095
  },
  "usage": {
    "input_tokens": 3415,
    "output_tokens": 249,
    "total_tokens": 5968,
    "model_requests": 3,
    "tool_calls": 2
  },
  "cost": {
    "currency": "USD",
    "total_usd": null,
    "status": "provider_response_does_not_supply_cost"
  },
  "attempts": [
    {
      "attempt": 1,
      "outcome": "failed",
      "http_status": 200,
      "payload_sha256": "cc0e82e4b53f70716ae76c2a61e978d68c5762d56f4a44887a1673a55904889b"
    },
    {
      "attempt": 2,
      "outcome": "failed",
      "http_status": 200,
      "payload_sha256": "9a11977593fd6854ed314c58c499d684302e41ea4cd3403e897913c9583f54b4"
    },
    {
      "attempt": 3,
      "outcome": "failed",
      "http_status": null,
      "payload_sha256": "8bebefbcd84da30cace396a4e06952d708d6e7fa375ec66606e653c3a57fdfe1"
    }
  ],
  "retry": {
    "max_retries": 0,
    "retries_used": 0,
    "repair_rounds_used": 0,
    "initial_requests": 3,
    "repair_requests": 0
  },
  "checkpoint": {
    "enabled": true,
    "sequence": 3,
    "state_sha256": "15ec1f5b479366e5df26682be41539992097a9d08e05d26a5b3b3eae0ea28f9c",
    "prior_event_hash": "1410d01044f5ece941b585ffca6cf53d0e38c75132ab25022d9775425e572ce8",
    "created_at": "2026-08-12T04:27:34.299Z"
  },
  "failure": {
    "type": "provider_unavailable",
    "provider_error_code": null
  },
  "result": {
    "action": "parse_failure",
    "structured_output": null,
    "structured_output_valid": false,
    "parse_error": {
      "category": "empty_output",
      "path": "/",
      "response_sha256": "e3b0c44298fc1c149afbf4c8996fb92427ae41e4649b934ca495991b7852b855"
    },
    "response_sha256": "e3b0c44298fc1c149afbf4c8996fb92427ae41e4649b934ca495991b7852b855",
    "raw_provider_response_stored": false
  },
  "redaction": {
    "applied": true,
    "raw_sensitive_response_persisted": false,
    "raw_submission_arguments_persisted": false,
    "secret_leakage_detected": false
  }
}
