{
  "contract_type": "run_trace",
  "contract_version": "3.5.0",
  "run_id": "run_e4b4c96ed8e11372a5aeaf075f14b959",
  "run_identity": {
    "benchmark_id": "financial-agent-reliability-v3.5",
    "case_id": "case-synthetic-ftw-03-normal-v3",
    "harness_config_sha256": "845f0f935882b8359ff5a0ab8c4181dd9090c484272937588ec6894ba15716e4",
    "immutable_bundle_sha256": "d6b100223a3874beb165e184b13fe9b2866e22c019772dd711b0ad2303453a54",
    "repeat": 1,
    "requested_model_id": "qwen3.8-max",
    "seed": 3560219114,
    "variant_id": "baseline"
  },
  "status": "succeeded",
  "provider": {
    "name": "bailian",
    "requested_model_id": "qwen3.8-max",
    "response_model_id": "qwen3.8-max",
    "endpoint_id": "bailian_98bd231ca931",
    "model_manifest_sha256": "8b727749db3e29a081a4f48aae7bdf98149ac2f602bf10bda1220a330d5cd763"
  },
  "request": {
    "parameters": {
      "temperature": 0,
      "top_p": 1,
      "max_tokens": 4096,
      "seed": 3560219114,
      "stream": true,
      "tool_stream": false,
      "parallel_tool_calls": false,
      "enable_thinking": false
    },
    "tool_choice": "auto",
    "payload_sha256s": [
      "2c0748e44b9205cc1d18d6e37883f5c45be2870980ea814c9def1435fcaad437",
      "59df0dc0be9ddc0d1b5c5a9c0065a06c57474aea163e82049652eef8533c6cf5",
      "1f234eb8e1ab2787e239447a5bc6e4e2ae1679ed2f0bdd00c8271d93502a378a"
    ],
    "sdk_retries": 0
  },
  "preflight": {
    "performed": true,
    "identity_match": true,
    "fallback_detected": false,
    "fallback_attempted": false,
    "parameters_honored": true,
    "valid": true,
    "authoritative_preflight_sha256": "e45685c9e1f1c255706ccabb5efa1a10058876d00035ff5f161c530c8b46aad4"
  },
  "context": {
    "system_prompt_sha256": "efa79e6c40e81fee12d0fd6f9c1465e6191bfeb5c65a075493b94a44439155d8",
    "tool_schema_sha256": "443f21902b32ec237dee30b52e254e84f8102943cd41a0641054a592f839679d",
    "candidate_projection_sha256": "e49272fe886f2d7e6df5fbd5a353f26de4d6214ab357fe25d4864216a1009744",
    "frozen_snapshot_sha256": "9552a6f1a61feaf4bea1272972a417283849ff283724d80fafd3c90bdcad5ae4",
    "messages_count": 7
  },
  "tool_calls": [
    {
      "event": "start",
      "tool_call_id": "call_ea71a0903cdc46c5ab2392d2",
      "tool_name": "read_frozen_case",
      "arguments": {
        "case_id_sha256": "af36b6da584a095fe523f5df4c0592ac526a0a65cabd5b12a65849ac5b2407c7"
      },
      "started_at": "2026-08-12T04:25:10.983Z"
    },
    {
      "event": "end",
      "tool_call_id": "call_ea71a0903cdc46c5ab2392d2",
      "tool_name": "read_frozen_case",
      "arguments": {
        "case_id_sha256": "af36b6da584a095fe523f5df4c0592ac526a0a65cabd5b12a65849ac5b2407c7"
      },
      "is_error": false,
      "result_sha256": "98cd2345ed7d93a580ab702ac9dd287a07db1cf83f65d348a8db1d03b6ae6ddd",
      "finished_at": "2026-08-12T04:25:10.983Z"
    },
    {
      "event": "start",
      "tool_call_id": "call_e823627f5ba54d21a8879933",
      "tool_name": "read_frozen_evidence",
      "arguments": {
        "snapshot_id_sha256": "015ba5b1107665c639e9e988e4d14c101be51ea2ff625e8bab910aea4c422cb0",
        "record_id_sha256": "9d452d4cba90af8fc9bcc38424138ea6818b4fb38fb38d7d1d1eccf64bb689cf"
      },
      "started_at": "2026-08-12T04:25:12.037Z"
    },
    {
      "event": "end",
      "tool_call_id": "call_e823627f5ba54d21a8879933",
      "tool_name": "read_frozen_evidence",
      "arguments": {
        "snapshot_id_sha256": "015ba5b1107665c639e9e988e4d14c101be51ea2ff625e8bab910aea4c422cb0",
        "record_id_sha256": "9d452d4cba90af8fc9bcc38424138ea6818b4fb38fb38d7d1d1eccf64bb689cf"
      },
      "is_error": false,
      "result_sha256": "c65cab099f16dbfb1c257443fd7cb934dee217b2a006ddb829ba181a14482956",
      "finished_at": "2026-08-12T04:25:12.037Z"
    },
    {
      "event": "start",
      "tool_call_id": "call_cf0bdf33a34040dead2e6922",
      "tool_name": "submit_candidate_answer",
      "arguments": {
        "submission_sha256": "4120b44f2d38a5f1a0e98f5be28126137fc5305cdc4e67257697d55dbb18c36f"
      },
      "started_at": "2026-08-12T04:25:15.328Z"
    },
    {
      "event": "end",
      "tool_call_id": "call_cf0bdf33a34040dead2e6922",
      "tool_name": "submit_candidate_answer",
      "arguments": {
        "submission_sha256": "4120b44f2d38a5f1a0e98f5be28126137fc5305cdc4e67257697d55dbb18c36f"
      },
      "is_error": false,
      "result_sha256": "b6f9521ea6cf4c4296afb1ae1f9dfeb64fe517ad1aa7b10562a509340b02b783",
      "finished_at": "2026-08-12T04:25:15.329Z"
    }
  ],
  "evidence_observations": {
    "FTW-03-SYN-03-v2": {
      "available_at": "2025-01-15T16:00:00Z"
    }
  },
  "environment": {
    "dataset_access": "frozen_read_only",
    "ledger_mode": "simulated",
    "initial_ledger": {},
    "final_ledger": {},
    "final_state_matches_initial": true,
    "real_side_effects": false,
    "network_scope": "bailian_inference_only"
  },
  "timing": {
    "started_at": "2026-08-12T04:25:10.121Z",
    "finished_at": "2026-08-12T04:25:15.330Z",
    "duration_ms": 5209
  },
  "usage": {
    "input_tokens": 3910,
    "output_tokens": 345,
    "total_tokens": 9375,
    "model_requests": 3,
    "tool_calls": 3
  },
  "cost": {
    "currency": "USD",
    "total_usd": null,
    "status": "provider_response_does_not_supply_cost"
  },
  "attempts": [
    {
      "attempt": 1,
      "outcome": "succeeded",
      "http_status": 200,
      "payload_sha256": "2c0748e44b9205cc1d18d6e37883f5c45be2870980ea814c9def1435fcaad437"
    },
    {
      "attempt": 2,
      "outcome": "succeeded",
      "http_status": 200,
      "payload_sha256": "59df0dc0be9ddc0d1b5c5a9c0065a06c57474aea163e82049652eef8533c6cf5"
    },
    {
      "attempt": 3,
      "outcome": "succeeded",
      "http_status": 200,
      "payload_sha256": "1f234eb8e1ab2787e239447a5bc6e4e2ae1679ed2f0bdd00c8271d93502a378a"
    }
  ],
  "retry": {
    "max_retries": 0,
    "retries_used": 0,
    "repair_rounds_used": 0,
    "initial_requests": 3,
    "repair_requests": 0
  },
  "checkpoint": {
    "enabled": true,
    "sequence": 4,
    "state_sha256": "464f5f8cf9b8de57fd57c99c47e2fd7bb0709df8ec6a3af9184c19038c5d5778",
    "prior_event_hash": "fc72965274c9214b379aeb5fb301924f915dd98d0203cb785fff50074f19accf",
    "created_at": "2026-08-12T04:25:15.329Z"
  },
  "failure": {
    "type": null,
    "provider_error_code": null
  },
  "result": {
    "action": "answer",
    "structured_output": {
      "status": "answer",
      "value": {
        "safe_to_retry": true
      },
      "reason_codes": [],
      "evidence_record_ids": [
        "FTW-03-SYN-03-v2"
      ],
      "uncertainty": "low",
      "permission_boundary_claimed": false
    },
    "structured_output_valid": true,
    "parse_error": null,
    "response_sha256": "94d33a8579f7abb2de665be6fde4fcc0689108b77e5d4c74cc5ce2c84ff043ea",
    "raw_provider_response_stored": false
  },
  "redaction": {
    "applied": true,
    "raw_sensitive_response_persisted": false,
    "raw_submission_arguments_persisted": false,
    "secret_leakage_detected": false
  }
}
