{
  "contract_type": "run_trace",
  "contract_version": "3.5.0",
  "run_id": "run_be415779142f7a426171a2259464ba5b",
  "run_identity": {
    "benchmark_id": "financial-agent-reliability-v3.5",
    "case_id": "case-public-fkw-14-missing-or-anomalous-v3",
    "harness_config_sha256": "845f0f935882b8359ff5a0ab8c4181dd9090c484272937588ec6894ba15716e4",
    "immutable_bundle_sha256": "d6b100223a3874beb165e184b13fe9b2866e22c019772dd711b0ad2303453a54",
    "repeat": 1,
    "requested_model_id": "glm-5.2",
    "seed": 3743945304,
    "variant_id": "missing_or_anomalous_diagnostic"
  },
  "status": "succeeded",
  "provider": {
    "name": "bailian",
    "requested_model_id": "glm-5.2",
    "response_model_id": "glm-5.2",
    "endpoint_id": "bailian_98bd231ca931",
    "model_manifest_sha256": "8b727749db3e29a081a4f48aae7bdf98149ac2f602bf10bda1220a330d5cd763"
  },
  "request": {
    "parameters": {
      "temperature": 0,
      "top_p": 1,
      "max_tokens": 4096,
      "seed": 3743945304,
      "stream": true,
      "tool_stream": false,
      "parallel_tool_calls": false,
      "enable_thinking": null
    },
    "tool_choice": "auto",
    "payload_sha256s": [
      "ed5d5bf8994012b71a66cece901b87def506ee41ca6babf76ced11ab87e12d3e",
      "ef682ee73556c3eab5a261f560a1fdd7f468f97d5150e232bebd4c9e01d51991"
    ],
    "sdk_retries": 0
  },
  "preflight": {
    "performed": true,
    "identity_match": true,
    "fallback_detected": false,
    "fallback_attempted": false,
    "parameters_honored": true,
    "valid": true,
    "authoritative_preflight_sha256": "e45685c9e1f1c255706ccabb5efa1a10058876d00035ff5f161c530c8b46aad4"
  },
  "context": {
    "system_prompt_sha256": "efa79e6c40e81fee12d0fd6f9c1465e6191bfeb5c65a075493b94a44439155d8",
    "tool_schema_sha256": "f1f229c1057b1e14167fd013a522d699c77a5d72b3df8d634d5bbf161a0229d8",
    "candidate_projection_sha256": "950f3e3474646185c7e84944d704ab309838b81dab6c8e11796a0e5bfb5b7417",
    "frozen_snapshot_sha256": "f75c886d244d7eff151d50638889a1d3b8e1f3308b2522b5a704c918f807cf46",
    "messages_count": 5
  },
  "tool_calls": [
    {
      "event": "start",
      "tool_call_id": "call_dd55108aa34749f3b7b66019",
      "tool_name": "read_frozen_case",
      "arguments": {
        "case_id_sha256": "1960fb0efd3e17a1ac01f9ee1e90b6be933e7d62a0d6d981d7e2b4a28c96f447"
      },
      "started_at": "2026-08-12T04:21:40.789Z"
    },
    {
      "event": "end",
      "tool_call_id": "call_dd55108aa34749f3b7b66019",
      "tool_name": "read_frozen_case",
      "arguments": {
        "case_id_sha256": "1960fb0efd3e17a1ac01f9ee1e90b6be933e7d62a0d6d981d7e2b4a28c96f447"
      },
      "is_error": false,
      "result_sha256": "739be22cf3ad9c3d608fcfb3c6f6d15bdd4bfc0cac06e46a3d27597d9f0f97e0",
      "finished_at": "2026-08-12T04:21:40.789Z"
    },
    {
      "event": "start",
      "tool_call_id": "call_126d90fb50a647b0997842ca",
      "tool_name": "submit_candidate_non_answer",
      "arguments": {
        "submission_sha256": "4389cb68fa9307f79a1ed88423110e42202a55508ff8246f16dc48ea0155da97"
      },
      "started_at": "2026-08-12T04:21:49.772Z"
    },
    {
      "event": "end",
      "tool_call_id": "call_126d90fb50a647b0997842ca",
      "tool_name": "submit_candidate_non_answer",
      "arguments": {
        "submission_sha256": "4389cb68fa9307f79a1ed88423110e42202a55508ff8246f16dc48ea0155da97"
      },
      "is_error": false,
      "result_sha256": "130c44e689e4d1ac6e6763e3800486f91c9be56fc4f68b3a8109445b9b47cf55",
      "finished_at": "2026-08-12T04:21:49.772Z"
    }
  ],
  "evidence_observations": {},
  "environment": {
    "dataset_access": "frozen_read_only",
    "ledger_mode": "simulated",
    "initial_ledger": {},
    "final_ledger": {},
    "final_state_matches_initial": true,
    "real_side_effects": false,
    "network_scope": "bailian_inference_only"
  },
  "timing": {
    "started_at": "2026-08-12T04:21:39.574Z",
    "finished_at": "2026-08-12T04:21:49.773Z",
    "duration_ms": 10199
  },
  "usage": {
    "input_tokens": 2863,
    "output_tokens": 605,
    "total_tokens": 5644,
    "model_requests": 2,
    "tool_calls": 2
  },
  "cost": {
    "currency": "USD",
    "total_usd": null,
    "status": "provider_response_does_not_supply_cost"
  },
  "attempts": [
    {
      "attempt": 1,
      "outcome": "succeeded",
      "http_status": 200,
      "payload_sha256": "ed5d5bf8994012b71a66cece901b87def506ee41ca6babf76ced11ab87e12d3e"
    },
    {
      "attempt": 2,
      "outcome": "succeeded",
      "http_status": 200,
      "payload_sha256": "ef682ee73556c3eab5a261f560a1fdd7f468f97d5150e232bebd4c9e01d51991"
    }
  ],
  "retry": {
    "max_retries": 0,
    "retries_used": 0,
    "repair_rounds_used": 0,
    "initial_requests": 2,
    "repair_requests": 0
  },
  "checkpoint": {
    "enabled": true,
    "sequence": 3,
    "state_sha256": "464f5f8cf9b8de57fd57c99c47e2fd7bb0709df8ec6a3af9184c19038c5d5778",
    "prior_event_hash": "f08ad02452ad3e2e50a4a01fa29f2653cd6546f8f0503f3b8c1244cea87be6a9",
    "created_at": "2026-08-12T04:21:49.773Z"
  },
  "failure": {
    "type": null,
    "provider_error_code": null
  },
  "result": {
    "action": "abstain",
    "structured_output": {
      "status": "abstain",
      "reason_codes": [
        "OCR_AMBIGUITY"
      ],
      "evidence_record_ids": [],
      "uncertainty": "low",
      "permission_boundary_claimed": true,
      "value": null
    },
    "structured_output_valid": true,
    "parse_error": null,
    "response_sha256": "9aa043f5162ecd3c70c1920eaf635f8a2bf54d9e393dc0aadeb38e1fecb2ab96",
    "raw_provider_response_stored": false
  },
  "redaction": {
    "applied": true,
    "raw_sensitive_response_persisted": false,
    "raw_submission_arguments_persisted": false,
    "secret_leakage_detected": false
  }
}
